{
  "$schema": "../../docs/repository-task.schema.json",
  "schema_version": 1,
  "name": "httpie-host-header-case",
  "repository_root": "../repositories/httpie-host-header-case",
  "issue": "HTTPRequest overwrites a user-supplied lowercase host header because it checks membership in a plain copied dict instead of the original case-insensitive header mapping.",
  "source_allowlist": ["httpie"],
  "target_test": "tests/test_regressions.py::test_Host_header_overwrite",
  "regression_suite": "tests/test_regressions.py",
  "diagnostic_queries": ["class HTTPRequest", "def _headers", "Host"],
  "pythonpath": ["."],
  "timeout_seconds": 120,
  "max_repository_bytes": 52428800,
  "max_repository_files": 2500
}
